Questions; Answers;
Comment calculer le salaire net ?; Le salaire net est la rémunération due à l’employé après soustraction  de son salaire brut de l’impôt  sur le revenue (IRPP) et de la cotisation de sécurité sociale due par l’ employé (9,18 % de salaire brut);
Pourquoi vous demandez un nouveau dossier administratif ?; POUR évaluer votre carrière et votre situation administrative et faciliter la gestion des ressource humaine;
Comment faire pour justifier une absence au travail ?; Le salarié répond par l’envoi d’une justification  valable (exemple  certificat médical pour préciser le raison de l’absence);
Combien de salarié dans votre entreprise?; Nous avons 1556 salariés;
Quels sont les différentes catégories de salariés ?; Les salariés se devisent comme suit on a les ouvriers  les techniciens encore les agents de maitrises et enfin les cadres;
 Comment savoir quel échéance je suis ?; Il faut se référer a la convention de l’entreprise pour connaitre la classification  l’échelon et le niveau a faire apparaitre sur la fiche de paie. Généralement les échelons sont codifies de 1 à 28 En un mot l’échelon est un indicateur permettant de situer le niveau d’expérience d’un salarié dans le système de classification dans l’entreprise;
Quel est le rôle principal du service achat ?; le service achat est responsable de la gestion de l’approvisionnement de l’entreprise et Cela inclus la recherche de fournisseurs et la négociation de prix;
Comment sélectionnez vous vos fournisseurs ?; nous sélectionnons nos fournisseurs en évaluant plusieurs critères tel que la qualité de produit ainsi que le prix et les délais de livraison;
Quelle sont les étapes de  processus d’achat ?; le processus achat typique comprend l’identification de besoins la recherche d’un bon fournisseur en plus demande de devis et la négociation et la passation de commande enfin la réception de biens ou la service ;
Comment assurez vous la conformité des achats avec la politique de l’entreprise ?; nous avons mis en place de procédures et des contrôles internes pour garantir que tous les achats respectent les politiques de l’entreprise;
Comment gérez vous les risques associées aux achats ?; En premier lieu nous identifions les risques potentiels puis nous diversifions nos base de fournisseurs et nous établissons des plans d’urgence;
Quel est le rôle de la direction achat ?; le rôle de la direction achat consiste à superviser l’ensemble des activités liées aux achats depuis la négociation avec les fournisseurs jusqu'à la gestion des stocks;
Pour quoi mettre en place un service achat ?; réduire les couts des tous les produits et accroitre la marge de l’entreprise ainsi qu’il fait augmenter la qualité de marchandise achetée enfin il prévenait l’entreprise tout les problèmes d’approvisionnement ou tout autre incident;
Quelle sont les missions de services achat ?; le service achat doit gérer les risques associées a l’approvisionnement;
Quels sont les différent types d’achats ?; il y a trois grand  types d’achat achat directs ou achat indirect et achat d’investissement;
Quels sont les axes des critères d’achat ?; il y a plusieurs axes de critères d’achat en premier lieu on a le prix puis  la qualité et la rapidité de livraison encore on a la disponibilité de produits et la capacité de respecter les termes des contrats ;
Quel est le nom de directeur de la société ?; C'est le Doc Ing TABBABI Mohamed;
Quel est la date de création de la société ?; Cette  société a été créé le 1/11/2012;
Ou se trouve votre siège social ?; Notre siège social est situé au Cité Moderne Redeyef 2120;
Quel sont vos activités ?; Nos activités sont avant tout la Plantation puis le Jardinage et la potection de l'environnement;
 Quel est le nombre Total des employées actifs ?; Le nombre des employées actifs est 1484;
Combien d’employés masculins dans votre entreprise ?; Dans notre entreprise on a 1396 employés masculins;
Combien d’employés féminin dans votre entreprise ?; On a 88 employés féminin;
Combien de Célibataire dans votre entreprise ?; Dans la société il y a 357 célibataires;
Combien de Divorcé avez-vous dans votre entreprise ?; Dans notre entreprise on a 12 Divorcés;
Quel est le nombre de Mariés dans la société ?; On a 1110 Mariés;
Combien des Veufs existent dans votre entreprise ?; il y a 5 Veufs dans notre entreprise ;
 Quel est le Pourcentage Effectif par satiation Familiale Célibataire ?; C’est de 24,06%;
Quel est le Pourcentage Effectif par satiation Familiale Divorcé ?; Le Pourcentage Effectif par satiation Familiale Divorcé est 0,81% ;
 Quel le Pourcentage  Effectif par satiation Familiale Marié ?; Le Pourcentage Effectif par satiation Familiale Marié est de 74,80%.;
Quel est le Pourcentage Effectif par satiation Familiale Veuf ?; Cette pourcentage est de 0,34%  Combien d’ancienneté  professionnelle Inferieur a 5 ans ?; On a 254 Inferieur a 5 ans .
Combien d’ancienneté professionnelle entre 6 et 10 ans ?; Il y a  386 entre 6 et 10 ans. ;
Combien d’ancienneté professionnelle entre 11 et 15 ans ?; On a 19 entre 11 et 15 ans.;
Combien d’ancienneté professionnelle entre 16 et 20 ans ?; Il y a 825  entre 16 et 20 ans;
Quel est le Pourcentage d'ancienneté professionnelle entre 5 ans ?;  C’est un pourcentage de 17,12%;
Quel est  le Pourcentage d'ancienneté professionnelle entre 6 et 10 ans ?; C’est un pourcentage de 16,01%;
Quel est le Pourcentage  d'ancienneté professionnelle entre 11 et 15 ans ?; C’est un pourcentage de 1,28% ;
Quel est le Pourcentage d'ancienneté professionnelle entre 16 et 20 ans ?;  C’est un pourcentage de 55,59% Quel est le Nombre actif Masculin Plus que 20  ans ?;0
Quel est le Tranche d'âge actif entre 18 et 25 ans ?;0;
Quel est le Tranche d'âge actif entre 26 et 30 ans ?;6;
Quel est le Tranche d'âge actif entre 31 et 35 ans ?;90;
Quel est le Tranche d'âge actif entre 36 et 40 ans ?;213;
Quel est le Tranche d'âge actif entre 41 et 45 ans ?;373;
Quel est le Tranche d'âge actif entre 46 et 50 ans ?;311;
Quel est le Tranche d'âge actif entre 51 et 55 ans ?;298;
Quel est le  Tranche d'âge actif entre 56 et 60 ans ?;193;
Quel est le Tranche d'âge Actif plus que 60 ans ?;0;
Quel est le Nombre Actif  Plus que 20 ans ?; un pourcentage de 0 %                                     Quel est le Tranche d'âge Actif entre 18 et 25 ans ?; un pourcentage de 0%
Quel est le Tranche d'âge Quel est le entre 26 et 30 ans ?; un pourcentage de 0,40%;
Quel est le Tranche d'âge Actif entre 31 et 35 ans ?; C’est un pourcentage de 6,06%;
Quel est le Tranche d'âge Actif entre 36 et 40 ans ?; C’est un pourcentage de 14,35%;
Quel est le Tranche d'âge Actif entre 41 et 45 ans ?; C’est un pourcentage de 25,13%;
Quel est le Tranche d'âge Actif entre 46 et 50 ans ?; C’est un pourcentage de 20,96%;
Quel est le Tranche d'âge Actif entre 51 et 55 ans ?; C’est un pourcentage de 20,08%;
Quel est le Tranche d'âge Actif entre 56 et 60 ans ?; C’est un pourcentage de 13,01%;
Quel est le Tranche d'âge Actif plus que 60 ans ?; C’est un pourcentage de 0%;
Quelle est l’importance des archives dans l’institution ?; L'archivage conserve les enregistrements et les informations importantes et aide à récupérer les données rapidement et efficacement;
Comment les archives peuvent elles être organisées efficacement ?; L'archivage  peut être organisé en utilisant des systèmes de classification clairs, tels que la classification chronologique ou thématique;
Quels sont les principaux défis de la gestion des archives ?; Les défis incluent la conservation des dossiers la garantie de la sécurité et la facilitation de l'accès;
Comment les archives numériques peuvent elles être préservées ?; Il est nécessaire d'utiliser des sauvegardes régulières encore  de mettre à jour les logiciels et d'assurer la sécurité des données;
Quelles normes doivent être suivies lors de la tenue des registres ?; Il faut suivre des normes légales  en plus opérationnelles et techniques pour garantir la qualité et l'accessibilité;
Comment former les employés à l'utilisation du système d'archives ?; Des ateliers et des formations pratiques peuvent être organisés pour les familiariser avec le système et les procédures de travail;
Quelles sont les technologies modernes utilisées dans les archives ?; Les technologies modernes incluent le stockage cloud de plus  l'intelligence artificielle et les systèmes de gestion de contenu;
Comment garantir la sécurité des archives ?; La sécurité peut être assurée par le contrôle d'accès ainsi  que le cryptage et les sauvegardes régulières;
Quelle est la période optimale pour conserver les registres ?; La période varie selon le type de dossier  mais il est nécessaire de revoir les politiques légales et administratives;
Comment améliorer l’accès à l’information dans les archives ?; L'accès peut être amélioré en fournissant des interfaces conviviales et des systèmes de recherche efficaces;
